tweet_links,created_at,usernames,full_text,language,reply,retweet,like,view
https://twitter.com/aakubiruu/status/1665374313720205312,2023-06-04 15:05:52,aakubiruu,Isin ra kowe pendekar2 #psht,in,1,0,1,3535
https://twitter.com/DFighter___/status/1665374250474283010,2023-06-04 15:05:37,DFighter___,"Diduga awal mula permasalahan antara kelompok PSHT dan Suporter  bola di Jogja
",in,0,2,5,2896
https://twitter.com/waradrupadi/status/1665374249983377409,2023-06-04 15:05:37,waradrupadi,"Gelas Portable
https://shope.ee/9p9Sk2x63k

Nunung sooyoung pendekar alan walker psht boiyen andara snsd besok senin mark lee yoona indra #FestaWithRM aku milikmu tamsis #WeStandWithBaekhyun lewis",in,0,1,0,1663
https://twitter.com/lunacuteaja/status/1665374180152311808,2023-06-04 15:05:20,lunacuteaja,"la kaosnya aja PSHT kok gak mau dibilang psht, ANEH",in,11,0,4,7476
https://twitter.com/DodiYanuri/status/1665374056487731200,2023-06-04 15:04:50,DodiYanuri,"Bapak e smpean kon gawe kumpulan mas ,dilumpukne ,sopo wae sek melu"" gruduk neng jogja dikeplaki siji"".
Ngisin""i jeneng PSHT mas",in,0,0,12,11986
https://twitter.com/kalcikalll/status/1665373996362215426,2023-06-04 15:04:36,kalcikalll,Punten jog kira2 psht kalo lawan Army menang sinten nggeh?,tl,4,4,2,8304
https://twitter.com/akhmadyudo/status/1665373993048715282,2023-06-04 15:04:35,akhmadyudo,makanya mas. kalau urusan psht sama bm aku dari kemarin no komen karena bukan urusanku. lha kok aku dibengoki ki wes dadi urusanku nek kuwi ,in,2,2,23,17319
https://twitter.com/combatcombat/status/1665373942654042112,2023-06-04 15:04:23,combatcombat,Tenang… PSHT Jaya ,in,0,0,1,1126
https://twitter.com/ElgarLouee/status/1665373939810312192,2023-06-04 15:04:23,ElgarLouee,Psht ni?,in,1,0,0,737
https://twitter.com/rdwnstoria/status/1665373914464403457,2023-06-04 15:04:17,rdwnstoria,PSHT KONTOL,tl,0,0,0,2319
https://twitter.com/Martanetlue/status/1665373842263650304,2023-06-04 15:03:59,Martanetlue,"koq cringe:' itu yg buat rusuh PSHT trus orang2 jogjanya bikin yel2 bgitu buat ngelawan PSHTnya,,,,",in,2,0,0,1050
https://twitter.com/Simbah_e_desa/status/1665373819639574528,2023-06-04 15:03:54,Simbah_e_desa,Soalnya di perempatan Kotagede ada tugu psht,in,0,0,0,1174
https://twitter.com/AndriTerjal22/status/1665373796444827650,2023-06-04 15:03:48,AndriTerjal22,"Kurang update ya mas wkkwkwkwkw , sea games Kamboja atlit PSHT oleh mendali emas ,makane mas update terus ,ora gur update Babakan pas elek e ",in,3,1,4,5971
https://twitter.com/mohonditunggu/status/1665373753394462720,2023-06-04 15:03:38,mohonditunggu,Sesepuh PSHT dicutter oknum komunitas seporter,in,1,0,0,746
https://twitter.com/_suwek_/status/1665373719810953216,2023-06-04 15:03:30,_suwek_,"Negara pasti memberi apresiasi kepada pencak silat seperti PSHT dsb atau para pendekar jika karena kependekarannya bersedia diberangkatkan ke daerah konflik, akan lebih bermanfaat. Seperti melawan KKB daripada cari jati diri dengan cara tawuran",in,0,0,1,1073
https://twitter.com/saintdelucaz/status/1665373668380233728,2023-06-04 15:03:18,saintdelucaz,"psht sama brajamusti menang siapa
menang dia yg seagama",in,5,0,2,4373
https://twitter.com/sempackteles5/status/1665373607013302273,2023-06-04 15:03:03,sempackteles5,Biyen Bonek nduwe masalah Karo PSHT yo gak mundur masio away nandi2,in,1,0,4,2467
https://twitter.com/apraxxx/status/1665373568698548224,2023-06-04 15:02:54,apraxxx,PSHT pendekar goblok,in,0,0,2,2662
https://twitter.com/masihrogab/status/1665373544027684864,2023-06-04 15:02:48,masihrogab,"@muhnoorfauzi hati2 si karo ngorsu, kae psht
@selaydanroti",tl,1,0,0,851
https://twitter.com/alfialf_/status/1665373528915427328,2023-06-04 15:02:45,alfialf_,sakit gmna sbnrnya kan udah selesai permasalahannya tsk jg udah ketangkap tp knpa psht masih rusuh ???,in,0,0,0,880
https://twitter.com/itsmeifann/status/1665373336749363202,2023-06-04 15:01:59,itsmeifann,"rung sido dikenani og wes dicekel, sepele su PSHT",in,0,0,0,970
https://twitter.com/arif26973169588/status/1665373309821931520,2023-06-04 15:01:52,arif26973169588,Cangkeman wae. Monggo ditunggu mase. Katanya pendekar kok pulang pake truk brimob HAHAHA PENDEKAR. PSHT OMPOL,in,0,0,5,2536
https://twitter.com/inisialaja_/status/1665373302217662469,2023-06-04 15:01:51,inisialaja_,Nglogok cenan PSHT,in,0,0,1,3839
https://twitter.com/akalpedia/status/1665373299403276288,2023-06-04 15:01:50,akalpedia,PSHT itu apa? Mereka yang kuasai dunia kah?,in,1,0,4,1816
https://twitter.com/fen24418/status/1665373294135218176,2023-06-04 15:01:49,fen24418,Tapi di tiktok saling ejek ga BM ga psht,in,2,0,0,4832
https://twitter.com/mashay____/status/1665373177571340288,2023-06-04 15:01:21,mashay____,"Kadose PSHT sudah kehilangan marwahnya mas 

Organisasi iku pemasukane gede pas pengesahan.

Sampean kiro² dewe lah.

Mesakke sing gak melu² dadi kegowo.",in,1,0,2,3467
https://twitter.com/MiliniumPa19030/status/1665373112454766593,2023-06-04 15:01:05,MiliniumPa19030,"Cm beberapa badut lompat pendekar yg menjijikan, di tanya lokasi cabang psht mana jg plonga plongo",in,0,0,6,1501
https://twitter.com/muhammadghema/status/1665373108423872512,2023-06-04 15:01:04,muhammadghema,"DATANG MEMBUAT ONAR, EH GABISA PULANG TERUS DIANGKUT, MASIH SEMPET NEMBAKIN KEMBANG API JUGA

PSHT LUCU ",in,17,26,362,68401
https://twitter.com/hampir_insap/status/1665373090421850112,2023-06-04 15:01:00,hampir_insap,PSHT....,en,0,0,0,298
https://twitter.com/yhanu_phutra/status/1665373090166046721,2023-06-04 15:01:00,yhanu_phutra,Tapi kata katane kita PSHT i,in,3,0,3,4726
https://twitter.com/MylRico/status/1665373072805994496,2023-06-04 15:00:56,MylRico,"Pusatnya aja di madiun,kalo PSHT dimana mana,bahkan Timor leste Malaysia juga ada",in,0,0,0,1307
https://twitter.com/alfialf_/status/1665373049510658049,2023-06-04 15:00:50,alfialf_,yoben wong membela kotane dewe kok demi keamanan kota jogja jg btw itu yg divideo warga jgja ya bkn psht,in,0,0,0,1234
https://twitter.com/HalimKusumi/status/1665372976311566338,2023-06-04 15:00:33,HalimKusumi,Siapkan formasi ada rombongan diduga Psht dari arah magelang lur!!!,in,0,2,7,3269
https://twitter.com/itsmeifann/status/1665372925766107136,2023-06-04 15:00:21,itsmeifann,PSHT SEPELE,in,0,0,2,2365
https://twitter.com/MrRafaell27/status/1665372919890051073,2023-06-04 15:00:19,MrRafaell27,"Aku yg mulai kecil ikut PSHT, tidak pernah diajarkan untuk berperang. Kalo bisa diselesaikan satu lawan satu, itu lebih gentle sih drpd harus bawa2 nama perguruan untuk berperang yg gak jelas. Menang jadi arang, kalah jadi abu.",in,20,0,65,32408
https://twitter.com/fen24418/status/1665372897949671427,2023-06-04 15:00:14,fen24418,"Wis to rausah gembede omongane Brajamusti gur ng Jogja tapi psht ng sak Indonesia ono,mikiro kedepane pas away nik liga wis mulai",in,15,0,2,5870
https://twitter.com/SMiaww19/status/1665372889410056196,2023-06-04 15:00:12,SMiaww19,"kan fungsi ikut komunitas begitu wkwk, biar ada yg beking dibelakangnya...ini kan indonesia...kita memang harus percaya kepada aparat hukum, tpi lebih bagus lagi klo ada bekingan komunitas...dripada PSHT nya yg ngamuk2 sampe bunuh2an vs supporter wkw, mending gini...",in,2,0,34,6014
https://twitter.com/def_defon/status/1665372791460311042,2023-06-04 14:59:49,def_defon,Dimana2 PSHT selalu bikin gaduh,in,1,0,1,1384
https://twitter.com/CerishIva/status/1665372786464899073,2023-06-04 14:59:48,CerishIva,"Cerita awale ora patiyo paham mas , sak ngertiku enek gesekan antara oknum anggota PSHT dengan oknum kelompok suporter PSIM Jogja. Dan akhire para pendekar do gruduk Jogja , sayang nya yg kedua ini para pendekar pulang nya minta diantar pak polisi mas.",in,1,1,0,1428
https://twitter.com/alfialf_/status/1665372759592140803,2023-06-04 14:59:41,alfialf_,yoben lebay wong membela kotanya sendiri kok btw itu yg di video tu orang jogja loh yaa bukan psht,in,1,0,1,1893
https://twitter.com/HalimKusumi/status/1665372661176778752,2023-06-04 14:59:18,HalimKusumi,Awas arah magelang diduga rombongan PSHT meluncur sedulur!!!,in,1,0,4,2830
https://twitter.com/AbankTho2/status/1665372647843061760,2023-06-04 14:59:15,AbankTho2,"Semoga
Apa lagi sama PSHT 
Si pendekar konvoi",in,1,0,1,753
https://twitter.com/fatyakresnawan/status/1665372632311808001,2023-06-04 14:59:11,fatyakresnawan,"Mungkin psht cuma punya referensi saat dulu melawan bonek, tapi tidak coba tanya-tanya ke polres kediri ",in,25,160,342,85266
https://twitter.com/Apri_Jogja/status/1665372601559183361,2023-06-04 14:59:03,Apri_Jogja,"Perguruan Setiap Hari Tawuran
Aku duwe konco sek pak Dhe ne dadi Sesepuh PSHT neng Ponorogo
Jare pek Dhe ne Isin delok warga PSHT saiki...",in,1,1,10,6997
https://twitter.com/northerncsl/status/1665372540120756224,2023-06-04 14:58:49,northerncsl,"""Mas harus percaya sama saya."" 

Berandai-andai, jika penegak hukum bisa antisipasi pergerakan massa silat/pendekar/ psht lebih awal tentu gak akan ada kerusuhan dan melebar kemana-mana. Masyarakat pun jelas percaya tanpa harus dikomandoi. 

#WisatawanTakutKeJogja",in,5,51,269,60890
https://twitter.com/deadcops1312/status/1665372476245786625,2023-06-04 14:58:34,deadcops1312,Ojok oleh moleh mas psht wkwkwk,in,0,0,2,2910
https://twitter.com/prasetyonis/status/1665372470684323840,2023-06-04 14:58:32,prasetyonis,"@DidikMukrianto monggo pak pengurus PSHT di evaluiasi pendekar pendekarnya ketoknya ilmu sejati ""setia hati"" gak di pahami pendekar2nya ckckc, masalah hukum sudah di tangani @PoldaJogja 

Trah MATARAM tanpa indonesia ra pateken #JOGJABERSATUTAKNISADIKALAHKAN",in,0,0,1,807
https://twitter.com/akutamvan1932/status/1665372428871303168,2023-06-04 14:58:22,akutamvan1932,"Aku sebagai warga jogja netral keganggu banget karo PSHT ki, tonggo ku dol bakso ra ngopo ngopo kok dikroyok maksude pie? Raimu mental patungan",in,0,0,8,3170
https://twitter.com/HalimKusumi/status/1665372219353051137,2023-06-04 14:57:32,HalimKusumi,"Awas arah magelang rombongan psht diduga meluncur sedulur, ICJ merapat siapkan formasi",in,1,1,25,5933
https://twitter.com/vat3lite/status/1665372216589168640,2023-06-04 14:57:32,vat3lite,"Wong silat psht ono sek digebuki supporter psim->cah2 psht ra trimo->lapor pak Pol kon nangkep->ra sabar kok ra ketangkep2->cah2 supporter psim e di drop psht

Kira2 tl;dr e ngono",in,3,0,1,1252
https://twitter.com/christ_tian10/status/1665372203209347079,2023-06-04 14:57:29,christ_tian10,"Ngadu gak ada bensi langsung di transfer, ngadu gak ada motor langsung dijemput, kalo lg sang* mnta langsung diajak ng*we
Ceritanya sok setia tapi busuk... Laknat...laknat.... 
PSHT JOGYA ALAN WALKER nunung jejak si gundul aku milikmutamsis boiyen",in,0,3,7,24819
https://twitter.com/basudewadikara/status/1665372199119642624,2023-06-04 14:57:28,basudewadikara,Bisa gak itu PSHT dibubarkan aja kalau buat rusuh terus.,in,0,0,2,1034
https://twitter.com/erikmen2705/status/1665372171374346240,2023-06-04 14:57:21,erikmen2705,"Psht iki kayanya problematik bgt sma suporter bola, di Surabaya bukannya Bonek jg smpet bersitegang sma psht ya",in,2,0,48,8242
https://twitter.com/alfialf_/status/1665372159596990464,2023-06-04 14:57:18,alfialf_,punten itu yg divideo orang jgja yg minta jaminan keamanan lohh bkn psht apakah salah minta jaminan keamanann biar gaada lg psht rusuh di jogja,in,2,0,3,1912
https://twitter.com/Ribow9/status/1665372144824451074,2023-06-04 14:57:15,Ribow9,"Info awal gegeran lur? Jane kepie dan ngopo to? 
#Jogja #psht #tamsis",in,1,0,0,4556
https://twitter.com/2k1nov/status/1665372135609581568,2023-06-04 14:57:12,2k1nov,jdi warga vs psht ,in,0,0,0,944
https://twitter.com/patdholi/status/1665372034640101377,2023-06-04 14:56:48,patdholi,kang dong joo nunung jejak si gundul gacoan psht markie taemin nasgor tamsis taeyeon sayang tiffany boiyen jogja sooyoung jaejoong yoona alan walker kim yuna #WeStandWithBaekhyun #DrRomantic3Ep12,in,0,2,2,2308
https://twitter.com/aduhsiucup/status/1665372011206688770,2023-06-04 14:56:43,aduhsiucup,"Liat trending psht vs warga jogja gila ngeri tawurannya, sampe polisi kabarnya kewalahan utk misahin",in,0,0,0,1705
https://twitter.com/uchiha_bernanto/status/1665372001417019399,2023-06-04 14:56:40,uchiha_bernanto,Bubarkan psht dari DIY,in,10,81,200,51741
https://twitter.com/Premanpasar20/status/1665371914691395586,2023-06-04 14:56:20,Premanpasar20,"Jangan gegabah mbak, inget psht organisasi besar jelas ada balasan ribu yang akan datang percayalah .. damai Indonesiaku",in,5,0,4,4763
https://twitter.com/alfialf_/status/1665371896076984323,2023-06-04 14:56:15,alfialf_,btw mb yg divideo itu justru lg ngebela kotanya lohh itu orang jogja minta jaminan keamanan buat kotanya sendiri  biar gaada lg psht rusuh di jogja,in,0,0,0,1571
https://twitter.com/awan_meendung/status/1665371836429787139,2023-06-04 14:56:01,awan_meendung,"Terpantau pendekar PSHT masih sempat menghidupkan petasan dr dalam truk polisi ketika diamankan, dan diarahkan ke warga jogja yg berada disekitaran jalan tamsis",in,343,810,2270,590102
https://twitter.com/WindiClara/status/1665371472460935168,2023-06-04 14:54:34,WindiClara,PSHT emang suka banget bikin onar mendidik manusia berbudi luhur tahu benar dan salah tai ngasu laah,in,2,0,0,1790
https://twitter.com/doni_dandis/status/1665371363576795138,2023-06-04 14:54:08,doni_dandis,Padahal dah teriak JOGJA BERSATU kok masih pada ngira orang itu dari psht wkwkwk,in,0,0,0,1721
https://twitter.com/komentartajam/status/1665371350104522752,2023-06-04 14:54:05,komentartajam,"PSHT PENDEKAR KONTOL, WES RUSUH, NYUSAHKE.. PADAKKE SING KENDEL KI GUR ORMASMU TOK PO?",in,0,0,7,1730
https://twitter.com/ChoyruImam/status/1665371294014242817,2023-06-04 14:53:52,ChoyruImam,duh PSHT iki loh ,in,0,0,0,950
https://twitter.com/alfialf_/status/1665371259373322244,2023-06-04 14:53:43,alfialf_,itu warga jogja ya bkn psht,in,0,0,1,1320
https://twitter.com/richardzzzt/status/1665371221230518272,2023-06-04 14:53:34,richardzzzt,Ini jane mau ki psht chapter ngendi je sing wani tekan kene ki ??,in,0,0,0,1481
https://twitter.com/a46gGam/status/1665371194252722181,2023-06-04 14:53:28,a46gGam,"warga kok, jadi ne emang ngusik lagi ya, urusan nya psht jadi sm seluruh warga jogja yg nangani nanti",in,0,0,0,1811
https://twitter.com/wonderthread/status/1665370992825229313,2023-06-04 14:52:40,wonderthread,"Forward chat e pie toh mas kalimat e? Kok janggal informasine. Awal e ""PSHT sengaja digiring oleh BM masuk wilayah kota"". Tapi endinge ""Dan parahnya dari tadi siang (BM) belum keluar sama sekali"". Njuk seng nggiring kui sopo mas?",in,3,1,25,14281
https://twitter.com/selalusybuk/status/1665370975444119552,2023-06-04 14:52:36,selalusybuk,"bu puan yang kuat dan sabar yaa..
@DppGemaPuan @_kiranalara
#PuanMaharani #TetapPuan #MbakPuan #PDIPerjuangan #Pemilu2024 #Pilpres2024 

Besok senin jogja PSHT",in,0,0,0,230
https://twitter.com/akutamvan1932/status/1665370936067883010,2023-06-04 14:52:26,akutamvan1932,"sebagai wong seng daerah e akeh seng melu psht, tak akoni opini mu bener mas. Rata rata neng kene melu psht ga nggo beladiri 1:1, bocil bocil -18 tahun nek tak takoni tujuan yo ben ndue dekengan wkwk ben nek gelud ndue bolo",in,0,0,0,1038
https://twitter.com/rakyatjelitacom/status/1665370925150388224,2023-06-04 14:52:24,rakyatjelitacom,aku ora mudeng critane. sing ngomong siap perang iku sopo? Polisi? Warga sing ora reti opo2? warga PSHT? Warga supporter bola? Warga PDI? mbuh lah,in,1,0,1,1652
https://twitter.com/orangnokturnal/status/1665370873631748097,2023-06-04 14:52:12,orangnokturnal,"PSHT wes ngisruh Nang Jogja, ijih nembaki mercon. Pendekar opo Wei. ",in,879,1968,5967,1630492
https://twitter.com/sekteNUsantara/status/1665370831466434566,2023-06-04 14:52:01,sekteNUsantara,Sampah2 psht nganggo jurus opo iki?,in,0,0,0,1573
https://twitter.com/Jerukni01528287/status/1665370823719522305,2023-06-04 14:52:00,Jerukni01528287,"PSHT Tamsis Jogja 
Qisruh",in,23,50,419,209765
https://twitter.com/den_mas_djo/status/1665370813091155968,2023-06-04 14:51:57,den_mas_djo,Melu #PSHT ki untunge opo???,in,0,0,0,1947
https://twitter.com/den_mas_djo/status/1665370714176716801,2023-06-04 14:51:34,den_mas_djo,"Melu #PSHT  ki asline untunge opo too???
Ben dadi pendekar paling kuat ngunu po??",in,0,0,1,3776
https://twitter.com/wimpitito/status/1665370680299253760,2023-06-04 14:51:25,wimpitito,PSHT itu apaan si ? Pasukan Sakit HaTi ?,in,0,0,0,1029
https://twitter.com/aryfse/status/1665370384475238400,2023-06-04 14:50:15,aryfse,PSHT luwung dibubarne ae. Akehan mudharate timbang manfaate,in,0,0,1,1258
https://twitter.com/educnte/status/1665370345480798208,2023-06-04 14:50:06,educnte,"Mic Karaoke Cipung 

https://shope.ee/8zaNdySKKQ

Nunung sooyoung pendekar alan walker psht boiyen andara snsd besok senin mark lee yoona indra #FestaWithRM aku milikmu tamsis #WeStandWithBaekhyun lewis",in,2,9,23,42474
https://twitter.com/joehelmiy/status/1665370327260741633,2023-06-04 14:50:01,joehelmiy,PSHT wkwkwkwk,in,0,0,0,1203
https://twitter.com/___manofculture/status/1665370196247232514,2023-06-04 14:49:30,___manofculture,psim vs psht,in,0,0,0,1825
https://twitter.com/akhmadyudo/status/1665370193089138690,2023-06-04 14:49:29,akhmadyudo,"bener mas urusane cah psht karo bm dengan urusane cah psht karo masyarakat kuwi wes bedo urusan. aku mbahas urusan sing karo masyarakat. nek sing karo bm yo terserah bm karo psht lah meh ngopo, tapi nek urusan karo masyarakat yo aku melu ngomong soale aku yo mau ngalami dewe",in,0,0,0,1580
https://twitter.com/alfialf_/status/1665370147849216001,2023-06-04 14:49:18,alfialf_,itu warga jgja btw bkn psht,in,0,0,1,1084
https://twitter.com/hubertus_guntur/status/1665370126458458113,2023-06-04 14:49:13,hubertus_guntur,"Koyone seko daerah diy deh, soale diy juga akeh sek melu psht. Tpi mbuh yo sek neng lapangan pie, opo seko luar jogja po diy juga.",in,0,0,1,5474
https://twitter.com/sekteNUsantara/status/1665370120422817793,2023-06-04 14:49:12,sekteNUsantara,Sampah impor dgn merk psht teraTAI,in,0,0,0,279
https://twitter.com/txtfromcylaa/status/1665370077414191104,2023-06-04 14:49:02,txtfromcylaa,gacoan nunung boiyen aku milikmu boleh jogja psht bulletproof re-debut nasgor markie tamsis eric sayang pendekat jejak si gundul nct dream is coming masih ada mark lee besok senin hapsun alan walker solaria malam minggu andara dewa 19,in,0,0,0,935
https://twitter.com/M_MahendraJKT48/status/1665370052861001734,2023-06-04 14:48:56,M_MahendraJKT48,Koe anggota PSHT po? Kok utemu kui guoblok tenan cok2.,in,0,0,0,1059
https://twitter.com/azaleazone/status/1665370029418790913,2023-06-04 14:48:50,azaleazone,gacoan nunung boiyen aku milikmu boleh jogja psht bulletproof re-debut nasgor markie tamsis eric sayang pendekat jejak si gundul nct dream is coming masih ada mark lee besok senin hapsun alan walker solaria malam minggu andara dewa 19,in,0,0,0,3025
https://twitter.com/ferry_arvian/status/1665369972346847232,2023-06-04 14:48:37,ferry_arvian,Mesti nek wis tekan psht ki arogan tenan,in,0,0,0,1022
https://twitter.com/mashay____/status/1665369805271207936,2023-06-04 14:47:57,mashay____,"Konfliknya sudah 2017 kmrn, ketika mubes parapatan luhur (parluh).
Terjadi perpecahan menjadi:
PSHT korlap (JJ08) dipimpin Mas Taufik
PSHT punjer madiun dipimpin Mas Moerdjoko.

Secara resmi sebenarnya PSHT hanya satu.
Korlap dan Punjer Madiun itu hanya istilah.",in,2,0,0,1657
https://twitter.com/akhmadyudo/status/1665369787009241094,2023-06-04 14:47:52,akhmadyudo,"aku rapaham mas kowe ki setengah kontra setengah setuju, sumpah aku rapaham maksudmu pie tapi sing jelas nek seko sing tak alami ki wes bedo masalah dengan urusan psht vs bm. iki masalah anyar, psht vs orang sekitar. aku ngalami dewe iki cen do golek2 karo wong kene mas",in,0,1,7,7291
https://twitter.com/alfialf_/status/1665369751370059777,2023-06-04 14:47:44,alfialf_,ya dia bilang gtu karna merasa rumahnya sndiri udah diusik pendekar dn dibuat ga aman ya dia membela kotanya sendiri menurut aku wajar btw itu video orang jogja minta keamanan biar gaada lg psht rusuh kejogja,in,1,0,1,2305
https://twitter.com/invstorkarbitan/status/1665369725998862336,2023-06-04 14:47:38,invstorkarbitan,Cah psht o mas?,in,0,0,0,1169
https://twitter.com/jarx_id/status/1665369704645500929,2023-06-04 14:47:33,jarx_id,Ngelingi jaman disik pas dadi panitia kemah SMA malah esuk2 bar subuh dijak senggel ro cah PSHT sek agi mabok Ngono we seh tak ladeni kyo resepsionis hotel sek ramah dan penuh senyuman,in,1,1,5,7037
https://twitter.com/boywonderrrr___/status/1665369648836276224,2023-06-04 14:47:20,boywonderrrr___,"Silat model taek ta konvoi terus
Wingi koncoku dikeroyok sampe mati, Saiki Jogja dirusak lagi"" diawali konvoi (beritanya)
Bubar ae silat e nek kisruh terus gajelas PSHT emang taek tok taek!!",in,0,0,0,1364
https://twitter.com/VIPNetizen/status/1665369640724316163,2023-06-04 14:47:18,VIPNetizen,#Jogja #Psht,qme,1,0,1,5917
https://twitter.com/ferdygonnadie/status/1665369632394342402,2023-06-04 14:47:16,ferdygonnadie,Psht sepele,in,1,0,0,1391
https://twitter.com/nadyameilianh/status/1665369570478264320,2023-06-04 14:47:01,nadyameilianh,"FREE ADOPT! 
Khusus buat pecinta kucing domestik. Asal dirawat dengan baik kitten usia 2 bulan. Ada 7 ekor bersih,gembul dan lucu. Bisa ambil di Kasihan Bantul atau COD Jogja

Nunung Jogja PSHT Pendekar Gacoan Tebal Tawuran Taman Siswa Timoho Balaikota Tamsis Sentul Ojol Bantul",in,0,0,1,4822
https://twitter.com/gamma_kid1/status/1665369309198307330,2023-06-04 14:45:59,gamma_kid1,Tapi itu masnya pake kaos logo PSHT bukan si? Cmiiw,in,2,0,0,15665
https://twitter.com/rasah_baperr/status/1665369279850758144,2023-06-04 14:45:52,rasah_baperr,Psht po? Rasah disensor to broo,in,0,0,0,1106
https://twitter.com/Hokii_wins/status/1665369263488765952,2023-06-04 14:45:48,Hokii_wins,PSHT,en,0,0,0,3
https://twitter.com/Sinthaweechai69/status/1665369135289704452,2023-06-04 14:45:17,Sinthaweechai69,ono info PSHT jateng nggruduk jogja valid mboten om?,in,3,0,0,4750
https://twitter.com/DonVampir/status/1665369121524187136,2023-06-04 14:45:14,DonVampir,PSHT ne wis kapok durung? Se jogja kompak!,in,0,0,1,1655
https://twitter.com/akutamvan1932/status/1665369033917759488,2023-06-04 14:44:53,akutamvan1932,"Aku ora psht aku ora bm, aku wong netral. Aku ra ngopo ngopo kok teko teko direseki pendekar pie ki, pendekar ajarane grudukan ngono to? Tak kiro diajari siji lawan siji",in,0,0,0,1081
https://twitter.com/akhmadyudo/status/1665369025881452544,2023-06-04 14:44:51,akhmadyudo,mas iki aku tenanan tulung dibales. akun asli wae ben podo2 penak. ndak malah kowe dikiro provokator ngaku2 psht.,in,1,0,3,4390
https://twitter.com/choirulanam__/status/1665369016595283969,2023-06-04 14:44:49,choirulanam__,"jare ono cah psht keno ajar wong jogja, padahal wes tekan hukum barang, sing kono rung trimo seko klaten nglurug jogja, sing ng jogja metu kabeh eh raisoh bali",in,1,0,0,1624
https://twitter.com/lopezubed14/status/1665368866824806401,2023-06-04 14:44:13,lopezubed14,"Jujur yaa faedahnya para pesilat konvoi itu ngapain sih cuk? Ngerayain apa? Kelulusan ?? Cuma nanya aja sih ini, dari yg sering gue denger para perguruan silat ini muridnya klo lulus atau apa gt pasti konvoi, di jalan lah geber². Emg nya di perguruan nya diajarin kek gt ya?? Psht",in,1,0,0,1105
https://twitter.com/one_saitma/status/1665368866581622784,2023-06-04 14:44:13,one_saitma,Ncen PSHT neng ndi ngone rese o mas,tl,2,0,8,5415
https://twitter.com/awanbiru907/status/1665368762537615367,2023-06-04 14:43:48,awanbiru907,"Laptop Canggih Harga Terjangkau

http://shope.ee/9zSrdffwEJ

aku milikmu nunung taeyeon boiyen jogja tawuran tamsis jaejoong malam minggu sooyoung yoona markie mark lee alan walker pendekar psht andara #FestaWithRM",in,4,5,10,18187
https://twitter.com/ElsaCatlovers/status/1665368754723737601,2023-06-04 14:43:46,ElsaCatlovers,"Doa terbaik untuk beliau ya mbak PM.
#PuanMaharani #TetapPuan #MbakPuan #PDIPerjuangan #Pemilu2024 #Pilpres2024
@addiems @_kiranalara 
PSHT Jogja Malam Minggu Besok Senin",in,0,0,0,1596
https://twitter.com/Aan_FNH/status/1665368516407754757,2023-06-04 14:42:50,Aan_FNH,PSHT bakingannya siapa ya?,in,3,0,3,9789
https://twitter.com/susisiikan/status/1665368499714228224,2023-06-04 14:42:46,susisiikan,PSHT apaan sih?,in,4,0,0,16824
https://twitter.com/2k1nov/status/1665368415400349696,2023-06-04 14:42:25,2k1nov,tawuran warlok sama psht yg tadi nya ngincer wisma suporter bola. denger2 gitu,in,0,0,0,1252
https://twitter.com/Alnkylckyndry/status/1665368290787741696,2023-06-04 14:41:56,Alnkylckyndry,“Para pendekar PSHT ingin balas dendam karena salahsatu anggota mereka dikeroyok supporter bola yg sedang berpesta” wait suporter bola yg mana nih? Mereka merayakan juara liga apa? ,in,5,0,8,20418
https://twitter.com/irfanfann8/status/1665368290338930689,2023-06-04 14:41:56,irfanfann8,Justru aneh lk ga konvoi tekan psht. Pendekar og. ,in,1,0,0,15785
https://twitter.com/barongXrangda/status/1665368234735071233,2023-06-04 14:41:42,barongXrangda,"Bener sekali, aku punya tetangga org psht pernah crita, psht skrg 2 kubu kok",in,1,0,0,2861
https://twitter.com/GofahG/status/1665368167005442051,2023-06-04 14:41:26,GofahG,"Monggo di rembuk maneh antar ranting ,misal onok kejadian kejadian seng pribadi ojok di sangkut pautno organisasi,opo gak sakno pendiri PSHT lek ngene ngene teros",in,1,0,4,4252
https://twitter.com/HalimKusumi/status/1665368125175627776,2023-06-04 14:41:16,HalimKusumi,"Warga ICJ Xt Square siap meluncur komandan ada info psht arah magelang perjalanan menuju kesini, siapkan formasi kita!!!",in,0,0,3,1061
https://twitter.com/Catatan_ali7/status/1665368122336104450,2023-06-04 14:41:16,Catatan_ali7,PENDEKAR KUI SOPO PSHT TA ??,in,0,0,0,1620
https://twitter.com/AdrianSitorus95/status/1665368051091664896,2023-06-04 14:40:59,AdrianSitorus95,"terkejut saya mbak pm. semoga bapak diterima ya di sisi-Nya @_kiranalara @KabGpmn
#PuanMaharani #TetapPuan #MbakPuan #PDIPerjuangan #Pemilu2024 #Pilpres2024 
Yoona Cutee Boiyen PSHT",in,0,0,0,218
