tweet_links,created_at,usernames,full_text,language,reply,retweet,like,view
https://twitter.com/maspongki_/status/1665508113078730752,2023-06-04 23:57:32,maspongki_,"PSHT ncen og nek ndi2 wanine kroyokan berlabel kata ""PERSAUDARAAN"" padahal ya perguruan lain adem ayem Iki malah gawe ribut ae kerjaane, gak nek jowo gak diluar jowo arogan merasa paling JOS sak dunyo",in,0,1,14,5620
https://twitter.com/BewoksXmoveUp/status/1665508010708402177,2023-06-04 23:57:08,BewoksXmoveUp,Musuh suporter dan psht itu sego padang. Dadi wis anteng dahar riyen nggih!.,in,0,0,1,1420
https://twitter.com/dz32221/status/1665507990135513088,2023-06-04 23:57:03,dz32221,Psht kont0L,ht,2,0,1,341
https://twitter.com/dreamersye/status/1665507845838651392,2023-06-04 23:56:28,dreamersye,Bubarin PSHT bisa ga sih?,in,0,0,0,213
https://twitter.com/frmnsyhbs/status/1665507835978067969,2023-06-04 23:56:26,frmnsyhbs,"jane nek pengurus PSHT tegas, nek ngawe jeneng organisasi elek iso cabut KTA ne atau apalah itu agar ada efek jera ,Ben do mikir sakdurunge bertindak, jane",in,1,0,4,2831
https://twitter.com/semuaudhselesai/status/1665507722706468865,2023-06-04 23:55:59,semuaudhselesai,itu kaosnya bukan psht mbak,in,0,0,0,449
https://twitter.com/Novemberain03/status/1665507443843952640,2023-06-04 23:54:52,Novemberain03,"Aspirasi sebagian (besar) warga pak : Bubarkan PSHT, karna sudah buat ricuh dimana² dan membuat mental arogan dikalagangan partisan remaja.",in,3,1,19,3932
https://twitter.com/sembada29/status/1665507383966138368,2023-06-04 23:54:38,sembada29,Wkwkwkw di lebar lebarke  tapi pendekar yang lain sudah pintar dan tau masalah ini dengan pendekar yang mana ?,in,0,0,1,481
https://twitter.com/Pai_C1/status/1665507362889691137,2023-06-04 23:54:33,Pai_C1," Senin 05 Juni 2023
Pernyataan Damai antara PSHT dan Brajamusti atas kejadian semalam.
...
 Jogja ",in,6,11,38,8177
https://twitter.com/mafikalamuhu/status/1665506887356551168,2023-06-04 23:52:40,mafikalamuhu,"Wah kalau kayak gini gw setuju sih sama PSHT, suporter kampungan emang meresahkan",in,0,0,0,352
https://twitter.com/in_makiy/status/1665506834122252292,2023-06-04 23:52:27,in_makiy,Padahal kan penyebabnya karena suami anggota DPRD yg kebetulan anggota PSHT melerai. Kalo ada partai baru ikut ya sama aja ada 2 partai yg rusuh?,in,0,0,0,944
https://twitter.com/kenapaka15/status/1665506735614996480,2023-06-04 23:52:04,kenapaka15,Perasaan emang dari dulu PSHT suka bikin rusuh,in,0,0,0,275
https://twitter.com/anwartanumyn/status/1665506725594791936,2023-06-04 23:52:01,anwartanumyn,"Wes dicekel mas, emang psht ne ae ra sabaran dan gampang kesulut emosine akhir e gawe rusuh. Nk wes lapor yo kudune protes ng polisine ojok ng warga sg gatau apa2 dadi korban",in,0,1,14,1655
https://twitter.com/srfvckdn/status/1665506666962378752,2023-06-04 23:51:47,srfvckdn,"Mambengi kubam ro ngobrol2 ro kancaku sing PSHT bocahe omong: ""Nyimak ae aku gak melok-melok soale ws bedo gak koyo biyen akeh sing melenceng"".

Didelok teko tweet iki valid ternyata omongane kancaku https://twitter.com/zidanpragata/status/1665345792993898502…",in,2,1,1,1261
https://twitter.com/pecanduqohwa/status/1665506644015341568,2023-06-04 23:51:42,pecanduqohwa,"Ket bien gk seneng aku mbek wong2 psht iki, sok2an",in,0,0,0,288
https://twitter.com/Variskconk21/status/1665506619562799104,2023-06-04 23:51:36,Variskconk21,Kericuhan terjadi dijalan Tamsis Yogyakarta pada Ahad malam kemarin. #Yogyakarta #tawuran #PSHT,in,0,0,1,2571
https://twitter.com/MBSasli/status/1665506616295432192,2023-06-04 23:51:35,MBSasli,"Lirboyo pernah diserang PSHT? Walah...
Base Camp Pager Nusa kan itu.
Edan nemen",in,0,0,0,278
https://twitter.com/LittleA56918841/status/1665505994674262017,2023-06-04 23:49:07,LittleA56918841,ya Allah PSHT lagi dan lagiiiiiiiiiii cape gw liatnya,in,0,0,0,280
https://twitter.com/in_makiy/status/1665505962998759425,2023-06-04 23:48:59,in_makiy,Bukannya anggota psht yg ktp jogja juga? Korbannya kan suami anggota dprd jogja?,in,0,0,1,498
https://twitter.com/in_makiy/status/1665505684811546628,2023-06-04 23:47:53,in_makiy,Anggota psht yg bikin rusuh bukannya ktp jogja juga?,in,0,0,0,488
https://twitter.com/zrratl/status/1665505460097794049,2023-06-04 23:46:59,zrratl,klo berita yg beredar si psim vs psht,in,0,0,2,2921
https://twitter.com/10461058abdb483/status/1665505226688983041,2023-06-04 23:46:04,10461058abdb483,"Sementara kelakuan pendekar PSHT tidak lebih baik. Bikin masalah sendiri, cari bolo sendiri, bawa rombongan.",in,0,0,2,1604
https://twitter.com/imamkecil69/status/1665504826149556225,2023-06-04 23:44:28,imamkecil69,"Oknum kok ribuan
Oknum kok satu komando",in,0,1,3,469
https://twitter.com/JohnToor1/status/1665504795237711873,2023-06-04 23:44:21,JohnToor1,"Kalo baca tentang PSHT kok isinya selalu tawuran, keroyokan, kerusuhan. Merugikan masyarakat semua. Negatif semua. Belum pernah baca berita PSHT berbuat manfaat. Misalkan nangkep begal, atau mengusir klitih.",in,112,179,1788,284355
https://twitter.com/piuserrr/status/1665504729080926208,2023-06-04 23:44:05,piuserrr,@PSHT_Indonesia  sikap!?,tl,0,0,0,351
https://twitter.com/yudhistiro29/status/1665504617805889536,2023-06-04 23:43:39,yudhistiro29,Yuuuh PSHT ,in,0,0,0,381
https://twitter.com/62enthusiast/status/1665504537627734016,2023-06-04 23:43:20,62enthusiast,"jangan memperkeruh suasana /provokasi 
pembubaran bukan solusi yg tepat malah menimbulkan masalah baru salahkan oknum nya jangan 1 organisasi yg kena

“Selama matahari terbit dari timur , selama bumi masih di huni manusia , selama itu pula psht akan berjaya selama lama nya”",in,2,0,0,897
https://twitter.com/luweh_nggambleh/status/1665504219837652993,2023-06-04 23:42:04,luweh_nggambleh,"@kapoldaDIY @kratonjogja @PemdaDIY tolong PSHT ini di bubarkan dan di jangan di kasih ijin lagi berada/buka cabang di Jogja,
Karena kelompok ini di mana"" sdh bikin rusuh, seblm di jogja mrk sdh sering bkin rusuh di daerah/propinsi lain, kelompok ini tergolong sangat meresahkan.",in,1,0,5,700
https://twitter.com/__heyjune__/status/1665504096928022531,2023-06-04 23:41:34,__heyjune__,Iki mutualku neng twitter ana cah PSHT ra to? Serius aku meh ngobrol tenan,in,4,0,0,413
https://twitter.com/depotcepot/status/1665504014702891016,2023-06-04 23:41:15,depotcepot,"Apa itu PSHT,
Taunya PSTD.
-vivid flashbacks (feeling like the trauma is happening right now)
-intrusive thoughts or images
-nightmares
-intense distress at real or symbolic reminders of the trauma
-physical sensations such as pain, sweating, nausea or trembling.",en,1,1,1,445
https://twitter.com/Adi72825025/status/1665503666906750976,2023-06-04 23:39:52,Adi72825025,Wkwkwk . Psht psht,in,0,0,0,247
https://twitter.com/fachry48__/status/1665503388254240768,2023-06-04 23:38:45,fachry48__,"Pendekar ko kaya sampah, ngotorin aja",in,0,0,1,2330
https://twitter.com/SamaruYess/status/1665503384085073921,2023-06-04 23:38:44,SamaruYess,JOGJA GAK BUTUH PSHT,in,0,0,3,1235
https://twitter.com/piuserrr/status/1665503240304177153,2023-06-04 23:38:10,piuserrr,@PSHT_Indonesia  monggo!?,in,0,0,0,2567
https://twitter.com/62enthusiast/status/1665503181055442945,2023-06-04 23:37:56,62enthusiast,"setiap saya melatih siswa psti saya menekankan apa yang salah itu jgn di tiru kepada adek adek saya mas

kalau di psht tidak ada yang paling pintar yg bisa ngasi konsekuensi hanya pengurus cabang / pusat tapi saya hanya bisa saling mengingatkan jika ada saudara saya yang salah",in,0,1,2,575
https://twitter.com/onlyfis/status/1665503167751290880,2023-06-04 23:37:53,onlyfis,Mentale gur mental keroyokan bubarke ae psht kontol,in,0,0,0,347
https://twitter.com/imamkecil69/status/1665503143202021376,2023-06-04 23:37:47,imamkecil69,"Cuk  
Ternyata PSHT rilis album High Octane Rock",in,0,0,0,1692
https://twitter.com/onlyfis/status/1665502946795356161,2023-06-04 23:37:00,onlyfis,Psht ki wes dadi gerombolan tai sg wanine gur keroyokan,in,0,0,0,163
https://twitter.com/babagan_bal/status/1665502924431310848,2023-06-04 23:36:55,babagan_bal,Hidup pesilat Indonesia. Kecuali PSHT,in,0,0,1,514
https://twitter.com/Crowsifa/status/1665502853064974341,2023-06-04 23:36:38,Crowsifa,pelaku pengroyokan anggota psht sudah ditangkap sebelum viral kenapa harus mengerahkan masa . SDM rendah emang bikin repot . kek domba ikut pawangnya digiring kemana aja ngikut wkwk,in,0,1,3,2123
https://twitter.com/c_conkz/status/1665502833607860225,2023-06-04 23:36:33,c_conkz,Balek balek kok psht kerasakti seng gae resek nak masyarakat,in,0,0,0,830
https://twitter.com/nantihujan/status/1665502534671245312,2023-06-04 23:35:22,nantihujan,PSHT : PERSATUAN SATU HATI TOLOL-TOLOL,in,5,0,22,3008
https://twitter.com/megantari_jogja/status/1665502369101103104,2023-06-04 23:34:42,megantari_jogja,Pripun kok Jogja digawe rusuh ?? Tak kandake gubernur DIY lho ,in,0,0,11,3234
https://twitter.com/srfvckdn/status/1665502354509053958,2023-06-04 23:34:39,srfvckdn,Baru kali ini lihat KS sama PSHT bersatu,in,0,0,0,500
https://twitter.com/djombaeka/status/1665502037612658690,2023-06-04 23:33:23,djombaeka,"Menurut ku ga bisa di pukul rata PSHT semua kaya gitu sih, Soal liat juga berita dari mereka yang mengharumkan nama Indonesia di Kanca Internasional, waktu ada bencana di Indonesia juga mereka ikut andil untuk membantu donasi dengan jumlah yang cukup besar.",in,61,1,24,28771
https://twitter.com/ramadianr_/status/1665501710410817539,2023-06-04 23:32:05,ramadianr_,Ngisin2i! Doktrin beladiri membela yang lemah gagal @PSHT_Indonesia,in,0,0,0,184
https://twitter.com/obingobing_/status/1665501648184045569,2023-06-04 23:31:51,obingobing_,"PSHT duta olahraga ancen e og, bengi2 ngajak polisi dan warga berolahraga atletik (lari & lempar) ",in,0,0,2,3660
https://twitter.com/richardzzzt/status/1665501514331455488,2023-06-04 23:31:19,richardzzzt,"Pendekar Ra ceto jebul mung sepele, dimata kami psht tidak lebih dari gerombolan ra jelas tukang bleyer da arogan",in,2,0,7,2128
https://twitter.com/ramadianr_/status/1665501247804416000,2023-06-04 23:30:15,ramadianr_,Bubarkan PSHT dari DIY. Bekukan anggotanya @humas_jogja @kapoldaDIY @JogjaUpdate @merapi_uncover,in,0,0,0,365
https://twitter.com/luweh_nggambleh/status/1665500881695932416,2023-06-04 23:28:48,luweh_nggambleh,"Pak Kapolda tolong di bubarkan saja PSHT ini karena sdh bikin rusuh di mana"" sebelum di jogja mreka sdh bikin onar di daerah/propinsi lain,
Ada indikasi mreka bakal menggantikan posisi ormas radikal di +62 ini,",in,9,2,43,10350
https://twitter.com/masuqiiin/status/1665500571321741313,2023-06-04 23:27:34,masuqiiin,"Jamet ngunu kui ta perwakilan PSHT, sepele.",in,1,0,0,2496
https://twitter.com/Irwansy28601688/status/1665500569623203841,2023-06-04 23:27:33,Irwansy28601688,"Sebagai org PSHT juga, malu banget gua cokkk, bener2 otak cuma jadi pajangan doang ",in,0,0,0,448
https://twitter.com/den_mas_djo/status/1665500353008214018,2023-06-04 23:26:42,den_mas_djo,"Banggamu dadi pendekar ki do ngopo too...
Hambok kerjo mikir anak bojomu malah penak tur ra resiko,koe..koe...mung kepanasen mergo geni kompore terlalu gedhe. #PSHT meresahkan",in,0,1,3,2313
https://twitter.com/svckkuate/status/1665500261903728640,2023-06-04 23:26:20,svckkuate,PSHT vs Brajamusti nuk,in,0,0,0,641
https://twitter.com/budhihermanto/status/1665500223140155392,2023-06-04 23:26:11,budhihermanto,PSHT gak dapat simpati di Jogja.,in,1,0,5,1149
https://twitter.com/SugiHantor24919/status/1665500069985136643,2023-06-04 23:25:34,SugiHantor24919,Kalau berbuat rusuh terus sudah saatnya dibubarkan Krn menganggu Kamtibmas. @mohmahfudmd @ListyoSigitP @jokowi. Rakyat menanti,in,0,0,0,158
https://twitter.com/LeePangestika/status/1665499990440177664,2023-06-04 23:25:15,LeePangestika,Salah satu PSHT ya?,in,1,0,0,371
https://twitter.com/62enthusiast/status/1665499934634946560,2023-06-04 23:25:02,62enthusiast,"ngapunten nggeh mas  

Leres Niku sangat ngawur mas sudah melenceng jauh dari sebuah ajaran,
Di ajaran psht padahal sudah jelas kita di suruh untuk memayu hayuning sesami 

banyak yang salah mengartikan atau mengaplikasikan persaudaraan itu seperti apa .",in,1,0,5,2110
https://twitter.com/LeePangestika/status/1665499924929343488,2023-06-04 23:25:00,LeePangestika,"Salah satu PSHT nih , yg tanding kalah protes ..",in,0,0,0,309
https://twitter.com/waltdodo/status/1665499829642883074,2023-06-04 23:24:37,waltdodo,Orang2 yg belajar bela diri tuh kemesok merasa hebat apalagi yg otaknya labil rasanya pengen nantangin seluruh manusia di bumi temen gw yg di psht klo di jalan tuh rasanya pengen di tantang sama preman pokoknya sok hero lah dihajar realita baru clengar clenger,in,3,1,5,3224
https://twitter.com/PolitikWaras/status/1665499826795036672,2023-06-04 23:24:36,PolitikWaras,PSHT kntooolll !! Pendekar SAMPAH !@,in,0,0,0,624
https://twitter.com/deelmonte/status/1665499826245763072,2023-06-04 23:24:36,deelmonte,PSHT emang problematik,tl,0,0,0,932
https://twitter.com/piuserrr/status/1665499745035632640,2023-06-04 23:24:17,piuserrr,@PSHT_Indonesia  se pendekar itukah!?,in,0,0,0,1083
https://twitter.com/TheBookIRead2/status/1665499698755428352,2023-06-04 23:24:06,TheBookIRead2,PSIM vs PSHT,in,0,0,0,506
https://twitter.com/PolitikWaras/status/1665499673895792640,2023-06-04 23:24:00,PolitikWaras,PSHT sampah !!,in,0,0,8,1173
https://twitter.com/mas_untungJa/status/1665499636382191616,2023-06-04 23:23:51,mas_untungJa,Suruh ganti rugi lah PSHT nya.. kalau tidak rongsokin aja motornya buat biaya ganti rugi..,in,0,0,9,3885
https://twitter.com/hampir_insap/status/1665499364582912000,2023-06-04 23:22:46,hampir_insap,PSHT,en,0,0,0,75
https://twitter.com/Ordinar39570489/status/1665499115692630017,2023-06-04 23:21:47,Ordinar39570489,"Bubarkan PSHT, bikin resah masyarakat",in,0,0,20,3821
https://twitter.com/esaindrwn/status/1665498782124118017,2023-06-04 23:20:27,esaindrwn,"ndisik PSIM po PSS mas?
saiki PSIM po PSHT mas?",in,0,0,0,1062
https://twitter.com/ajidan929/status/1665498664171601922,2023-06-04 23:19:59,ajidan929,"Sayangnya fakta di lapangan bukan vs Brajamusti ya pak , hehehe terutama di tamsis , aliansi warga keluar semua karena banyak toko , dagangan dan rumah warga yang rusak akibat ulah psht ini , semoga nantinya pihak kepolisian terbuka untuk warga jogja yang meminta tanggungjawab.",in,2,6,95,21485
https://twitter.com/SugiHantor24919/status/1665498336483487748,2023-06-04 23:18:41,SugiHantor24919,@jokowi @ListyoSigitP @mohmahfudmd  mohon ijin pak. Untuk dievaluasi ulang keberadaan organisasi tersebut Krn selama ini terkait dg kondisi Kamtibmas di tengah kedamaian masyarakat. Mohon diindahkan. Rakyat menanti.,in,0,0,1,323
https://twitter.com/muhararpajidi/status/1665497814271688705,2023-06-04 23:16:37,muhararpajidi,Ki jogja sing salah supporter bolane po PSHT ne. Butuh sumber info konkrit,in,0,0,1,449
https://twitter.com/arfakevin16/status/1665497787059040256,2023-06-04 23:16:30,arfakevin16,Psht goblog,cy,0,0,1,1905
https://twitter.com/azizarifin101_/status/1665497739013115907,2023-06-04 23:16:19,azizarifin101_,Bubarkan PSHT PENJARAKAN WAJIB,in,0,0,0,467
https://twitter.com/entrasolcoklat/status/1665497714443034624,2023-06-04 23:16:13,entrasolcoklat,Maksute ono provokator musuh perguruan psht ngunu ta?,in,2,0,1,6215
https://twitter.com/RenggaWahana/status/1665497521484091392,2023-06-04 23:15:27,RenggaWahana,"gak kabeh wong psht ngono mas. aku yo wong psht, yo miris ngerti kelakuan dulur-dulurku kui. padahal aku nang kene ngelatih awan bengi ben nduweni dulur sing andhap asor, iso ngajeni siji lan liyane, lha ning njobo, dulurku malah rakaruan ngonokui",in,6,0,2,1163
https://twitter.com/piuserrr/status/1665497204235051009,2023-06-04 23:14:11,piuserrr,sikap!? tindakan!?,in,0,0,1,1357
https://twitter.com/SooJun97650962/status/1665497161272811524,2023-06-04 23:14:01,SooJun97650962,2023 pendekar PSHT atau Pasukan Sakit HaTi  VS Warga....... Namanya Genk Motor berguru silat itu untuk apa kalo ga Buat Onar dan tawuran......mbegal???,in,0,0,2,5461
https://twitter.com/merapi_uncover/status/1665496782963367938,2023-06-04 23:12:31,merapi_uncover,"Pertemuan ini merupakan WUJUD NYATA KOMITMEN BERSAMA agar kejadian petang kemarin tidak semakin melebar akibat dari disinformasi maupun oknum provokator yang sengaja membuat hoax di media sosial.
.
Karena sejatinya dari Brajamusti ada yang juga warga PSHT, begitupun sebaliknya.",in,5,24,142,84791
https://twitter.com/merapi_uncover/status/1665496615086596096,2023-06-04 23:11:51,merapi_uncover,"KOMITMEN MENJAGA JOGJA
.
Senin pagi (5/6) disaksikan langsung oleh Kapolda D.I. Yogyakarta Irjen. Pol. Suwondo Nainggolan, S.I.K., M.H., perwakilan dari suporter sepak bola PSIM Yogyakarta yaitu Brajamusti bertemu dengan perwakilan dari perguruan silat PSHT. |@PoldaJogja",in,146,300,1054,269527
https://twitter.com/primDblacklung/status/1665496395409920000,2023-06-04 23:10:58,primDblacklung,lek oknum ki siji loro paling mas.. lho kui sak rombongan kok po yo isih iso muni oknum?,in,0,0,1,297
https://twitter.com/RenggaWahana/status/1665496051522969602,2023-06-04 23:09:36,RenggaWahana,"PSHT ada dualisme mas. rata2 orang yg mengikuti pusat madiun, itu lebih berperan dalam latihan dan tidak terlalu mementingkan hal-hal diluar organisasi seperti tawuran, bentrok, dll karena memiliki peraturan dan norma yg harus di terapkan dalam organisasi.",in,0,0,5,743
https://twitter.com/Irwansy28601688/status/1665495709649448961,2023-06-04 23:08:15,Irwansy28601688,"Gua juga orang PSHT mas, cuma coba liat dgn perspektif yg lebih luas, sadar bahwa kita ga hidup sendiri, ada banyak hak2 warga jogja di sana terlepas orang PSHT yg benar tp klo merugikan banyak orang gitu apa ya dibenarkan? Gua percaya orang PSHT orang2 yg intelektualnya tinggi2",in,0,0,1,888
https://twitter.com/nursetojati/status/1665495518456459264,2023-06-04 23:07:29,nursetojati,PSHT vs Warga Jogja,in,0,0,2,806
https://twitter.com/wicaksono_52241/status/1665495210082615297,2023-06-04 23:06:16,wicaksono_52241,"@PoldaJogja di Madiun pusatnya juga sering gegeran ini PSHT, udahlah gak usah konvoi segala mancing kerusuhan",in,0,0,0,201
https://twitter.com/si_gembira/status/1665495181532229632,2023-06-04 23:06:09,si_gembira,Psht persatuan setia hati tawuran,in,1,0,0,304
https://twitter.com/RenggaWahana/status/1665495162070638592,2023-06-04 23:06:04,RenggaWahana,kenapa mas? bisa di jelaskan sogokan darimana?,in,1,0,0,412
https://twitter.com/singusuu/status/1665495023117271043,2023-06-04 23:05:31,singusuu,Ra aktif kang akun ee,in,0,0,0,577
https://twitter.com/araampa/status/1665495011293806594,2023-06-04 23:05:28,araampa,Psht sbnernya kelompok apaan si,in,1,0,2,2073
https://twitter.com/RenggaWahana/status/1665494927264948225,2023-06-04 23:05:08,RenggaWahana,"sampean bilang e ""pendekar-pendekar"" berarti menyangkut keseluruhan dan bukan hanya beberapa oknum yg ikut dalam peristiwa tsb.",in,2,0,0,1125
https://twitter.com/piuserrr/status/1665494352188305408,2023-06-04 23:02:51,piuserrr,aku rep ngetag akun psht resmi Twitter e ono ra to?!?,in,0,0,0,1644
https://twitter.com/e_r_ja/status/1665494228158537728,2023-06-04 23:02:22,e_r_ja,bubarin ajj psht,in,0,0,0,168
https://twitter.com/ThoSupra/status/1665493985614528512,2023-06-04 23:01:24,ThoSupra,"Lho sam!!!
PSHT iku apais ???",in,3,0,0,4047
https://twitter.com/Mutt_muttm/status/1665493839669329921,2023-06-04 23:00:49,Mutt_muttm,|| Dewa 19 JEJAK SIGUNDUL Andara Ukraina Tidur De Gea Jihyo Senin boiyen Nasgor Aku Milikmu JJK1 IS COMING Alan Walker Milan PSHT BaKri mark lee ||,in,0,0,0,172
https://twitter.com/SyarihadaAkbar/status/1665493376597123074,2023-06-04 22:58:59,SyarihadaAkbar,Asu asu PSHT taek di mbarke FPI lgsung di bubarke wkwkwk,in,0,0,0,229
https://twitter.com/coolbreezeshine/status/1665493049705627653,2023-06-04 22:57:41,coolbreezeshine,kalo ga slh psht sm supporter psim,in,0,0,0,1272
https://twitter.com/gabe_gshin/status/1665492948694495233,2023-06-04 22:57:16,gabe_gshin,"Terserah mau bacot apa, aku 30 thn di dunia beladiri udah tau track record rombongan yang kau bela. 
Lha wong anake pengurus psht jateng aja ikut jadi korban e.",in,1,3,29,12544
https://twitter.com/adnnrm/status/1665492318001197057,2023-06-04 22:54:46,adnnrm,inisial psht,in,0,0,0,2077
https://twitter.com/binnybunny96/status/1665492205383942144,2023-06-04 22:54:19,binnybunny96,kukira PSHT tu antara nama suporternya klub bola Solo atau nama fansclubnya Happy Asmara,in,4,0,5,10076
https://twitter.com/BagasSubandi/status/1665491881911029760,2023-06-04 22:53:02,BagasSubandi,Mantap bossss,ht,0,0,0,279
https://twitter.com/Neo_Onismayag/status/1665491828144054274,2023-06-04 22:52:49,Neo_Onismayag,"Biasanya PSHT ribut sesamanya
Antara Teratai dan Kenanga ( Winongo ) ?
Ini kok kabarnya sama warga ?",in,1,0,1,60
https://twitter.com/batagormaniez/status/1665491725819998209,2023-06-04 22:52:25,batagormaniez,"Mbak iku wong jogja sek resah sama PSHT Mbak, mending dihapus timbang mengko cah jogja do ra trimo mbek awakmu mbak",in,1,0,2,485
https://twitter.com/sumbawanews/status/1665491556630171650,2023-06-04 22:51:45,sumbawanews,"Purnama.yg indah diatas cipanas kota terlihat jelas dari Glamping http://reaveecafe.com puncak Cipanas, Senin 5 mei 2023 pukul 05.25 wib.

Tawuran jejak si gundul PSHT Ukraina tidur dewa 19 Andara pendekar #LoveStory #reaveecafe",in,0,1,0,1454
https://twitter.com/aidimursyid/status/1665491406738296836,2023-06-04 22:51:09,aidimursyid,anggota psht merangkap,in,0,0,0,196
https://twitter.com/SyarihadaAkbar/status/1665491087245320194,2023-06-04 22:49:53,SyarihadaAkbar,"Bikin aturan tegas..PSHT dilarang di Jogja
Dan siapapun yg bikin kerusuhan di jogja kalau tertangkap diusir dari jogja walaupun itu warga jogja sendiri.
Si sebelah Desa tmpat tinggal saya dulu juga sering rusuh bukan tawuran lagi rapi perang banyak korban-",in,5,4,97,13195
https://twitter.com/HasanRiski44977/status/1665490607635333120,2023-06-04 22:47:58,HasanRiski44977,Lah emang mati? Kog nyawa dibales nyawa,in,0,0,0,684
https://twitter.com/fajar94721141/status/1665490431772364800,2023-06-04 22:47:16,fajar94721141,TNI POLRI BANYAK ORANG PSHT BRO WKWKW,in,1,0,0,430
https://twitter.com/diwaykey/status/1665490348863258624,2023-06-04 22:46:57,diwaykey,"Rekomendasi Buku Murah di Gramedia

Yogyakarta rusuh psht UCL

Psychology of Money (Morgan Housel)

 https://shope.ee/5fJwCVfVYW",in,1,0,1,376
https://twitter.com/Groargro/status/1665490302206115842,2023-06-04 22:46:46,Groargro,Laaa bedane ro psht kroyokan  ngehajar tukang parkir neng ngarep taman pintar kae opo mas ? ?,in,0,0,69,8465
https://twitter.com/ahsanerier/status/1665489965101248512,2023-06-04 22:45:25,ahsanerier,Bubarne ae PSHT BUOSSOOKKKK di video ae wedi pengecut cokk,in,0,0,0,523
https://twitter.com/WagimanDeep212_/status/1665489863284539392,2023-06-04 22:45:01,WagimanDeep212_,"Masyarakat Jogja masih sweeping anggota PSHT...
Kayaknya klo udah berurusan dengan masa bginih Pendekar jaman skarang bakal hilang kekar jadi pendek nyalinya.",in,137,277,1242,469956
https://twitter.com/aidimursyid/status/1665489808196767744,2023-06-04 22:44:48,aidimursyid,psht,en,0,0,0,216
https://twitter.com/amanwholoves_/status/1665489745919574022,2023-06-04 22:44:33,amanwholoves_,"PSHT, T itu Tawuran?",in,1,0,0,1895
https://twitter.com/VellocityBEE/status/1665488995537788928,2023-06-04 22:41:34,VellocityBEE,".

SIAPA YANG BISA BAWA ""INDONESIA"" DISEGANI BANGSA LAIN
.
.

Tawuran Dewa 19 PSHT 
JEJAK SI GUNDUL",in,1,0,4,7949
https://twitter.com/dedy_sb_/status/1665488808740093955,2023-06-04 22:40:49,dedy_sb_,Iya PSHT,in,1,0,0,138
https://twitter.com/yngvingi/status/1665488703576309760,2023-06-04 22:40:24,yngvingi,Psht apa mba?,in,1,0,0,1708
https://twitter.com/sigitmawardi/status/1665488357072273409,2023-06-04 22:39:02,sigitmawardi,Mumpung durung kebacut......,in,0,0,0,613
https://twitter.com/ofik_mrem/status/1665488307931996160,2023-06-04 22:38:50,ofik_mrem,Bubar ae.,in,0,0,1,1769
https://twitter.com/meIihatIihat/status/1665488285374861317,2023-06-04 22:38:45,meIihatIihat,"Emas tai po, ora kabeh pesilat kui wong psht",in,0,0,0,1088
https://twitter.com/pengentwitt/status/1665488118844391425,2023-06-04 22:38:05,pengentwitt,"Lha yo kui,masku reka e melu PSHT wis ora kerjo melu ndadak kon tuku pitek rego 500ewu arep direwangi golek utangan,lha goblok.",in,0,0,5,1684
https://twitter.com/HelpNe2/status/1665487537689833472,2023-06-04 22:35:46,HelpNe2,Iki mas sek aktif @pshterateindo,in,0,0,1,723
https://twitter.com/gongxipatkay/status/1665486937950502912,2023-06-04 22:33:23,gongxipatkay,arek BM sg melu perguruan PSHT iku menyakiti diri sendiri opo yaopo yo? ~merasabingung,in,0,0,0,501
https://twitter.com/junmisugi1212/status/1665486828886200321,2023-06-04 22:32:57,junmisugi1212,brajamusti dan psht kelompok apa? ,in,2,0,0,2276
https://twitter.com/PenikmatHibura2/status/1665486751341907969,2023-06-04 22:32:39,PenikmatHibura2,"PSHT vs Bonek
PSHT vs Aremania
PSHT vs Brajamusti
Saran saya kalau PSHT ketemu suporter bola langsung lapor polisi aja karena dua kelompok ini kalau udah ketemu kemungkinan bakal rusuh",in,4,1,34,5009
https://twitter.com/gesitoarhn/status/1665486744412733444,2023-06-04 22:32:37,gesitoarhn,psht i kumpulan opo bang,tl,1,0,0,878
https://twitter.com/amalyusup/status/1665486553316204545,2023-06-04 22:31:52,amalyusup,"tanya beneran lur, klo ada anggota PSHT dan dia juga suporter bola, apakah dia akan gebuki awak e dewe?",in,2,0,3,1743
https://twitter.com/06ramones/status/1665486551860805632,2023-06-04 22:31:51,06ramones,Jijik ntn psht peplyon ng dln kbk lendut ky cleng,in,0,0,0,3060
https://twitter.com/aldi_sapto/status/1665486426463694849,2023-06-04 22:31:21,aldi_sapto,"Semoga dari peristiwa ini bisa lebih di perketat lagi peraturan di dalam perguruan #PSHT untuk menghimbau peristiwa ini tidak terulang lagi, dari umur minimal di atas 18+ dan di sumpah tidak melakukan kekerasan yang mengakibatkan perkelahian.
#SALAMDAMAI #DIY",in,1,1,12,4879
