tweet_links,created_at,usernames,full_text,language,reply,retweet,like,view
https://twitter.com/jisoo_opp/status/1665397193447178240,2023-06-04 16:36:47,jisoo_opp,Sak durunge psht lahir jogja wes biasa babakan perang cuk jancuk.,in,0,0,0,1660
https://twitter.com/Akd50512689/status/1665396855352573954,2023-06-04 16:35:26,Akd50512689,Psht itu maksutnya apa maap nanya?,in,0,0,0,1513
https://twitter.com/fatopematt/status/1665396663211393026,2023-06-04 16:34:40,fatopematt,@Erliandwiputra Iki PSHT Madiun lur,in,0,0,0,2672
https://twitter.com/iniitehsusu/status/1665396522304016384,2023-06-04 16:34:07,iniitehsusu,"masalahnya bukan cuma satu kali kasus seperti ini melibatkan nama PSHT , apa kaga ada seleksi gitu untuk masuk PSHT atau dirombak aja isinya ga usah banyak2 anggota per cabangnya,mending anggota sedikit namun berkualitas daripada banyak kelakuannya seperti ini merusak nama PSHT",in,0,0,0,496
https://twitter.com/azkabsurd1/status/1665396489299038209,2023-06-04 16:33:59,azkabsurd1,"Bikin malu aja PSHT ini, temen2 Jogja plat AE jangan di sweeping yaa, saya sering main ke Jogja takut ada sweeping gara2 kasus ginian ",in,1,0,3,1024
https://twitter.com/starroving1/status/1665396488208302082,2023-06-04 16:33:59,starroving1,sepongen terus mas psht mu wkwkwkw,in,0,0,2,492
https://twitter.com/tukangshareid/status/1665396483460349995,2023-06-04 16:33:57,tukangshareid,"A lest4ri
https://dooood.com/f/39t5p8axl8

boiyen malam minggu besok senin andara psht jogja nasgor siwon bakri buddha dewa 19 aku milikmu hapsun solaria

bntu rtweet follow",in,3,39,139,58646
https://twitter.com/FranciscusAbel/status/1665396448035315716,2023-06-04 16:33:49,FranciscusAbel,Dibaca masa kronologine kui cah psht ra terimo koncone di aniaya cas brajamusti,in,1,0,1,849
https://twitter.com/ekowahyujunaid_/status/1665396060909600768,2023-06-04 16:32:17,ekowahyujunaid_,"Ndi pendekar e? Kok rame? Mentale kok preman, jare pendekar? Iki preman sing teko, udu pendekar, melu PSHT mung dinggo nggolek perlindungan nek ono masalah.",in,1,0,11,5728
https://twitter.com/zdoank90/status/1665396010418335747,2023-06-04 16:32:05,zdoank90,"Ah taek loro karone, koen taek gk ??? Psht ambek suporter bola, norak cok !!! katrok",in,0,0,0,476
https://twitter.com/eLbaraj_/status/1665395952138571776,2023-06-04 16:31:51,eLbaraj_,"Jogja PSHT apa gara-gara yang satu ini gagal ta... https://youtu.be/BWJIpI2Aqa0
#jogja #psht",in,0,0,0,1976
https://twitter.com/PakSurat/status/1665395894668206080,2023-06-04 16:31:37,PakSurat,"Polisi juga banyak anggota PSHT, penting warga Jogja Podo siaga, mugo"" sehat kabeh",in,1,0,0,1983
https://twitter.com/tutuptitip/status/1665395645971148803,2023-06-04 16:30:38,tutuptitip,ikut ke PSHT atau Jogja bang ?,in,2,0,4,8196
https://twitter.com/Tumitum22/status/1665395431340163072,2023-06-04 16:29:47,Tumitum22,"Iki sakjane PSHT ngendi to? Kok bengi iki infone diputer balik nang pramabanan karena kloter 2 meh masuk jogja, berarti arah e dho seko wetan iki? Hmmm ",in,0,0,1,1452
https://twitter.com/LeePangestika/status/1665395137403559942,2023-06-04 16:28:36,LeePangestika,"Itu kaosny teratai , psht jg ada org jogja",in,2,0,1,4016
https://twitter.com/Jerukni01528287/status/1665395083313643520,2023-06-04 16:28:24,Jerukni01528287,Rombongan PSHT dari luar kota diminta petugas putar balik di batas kota ga diperkenankan masuk kota,in,11,8,84,56968
https://twitter.com/poriskha/status/1665394982914490371,2023-06-04 16:28:00,poriskha,psht vs pasukan kanjeng ratu kidul menang mana ya,in,0,0,0,509
https://twitter.com/CirebonText/status/1665394881747902471,2023-06-04 16:27:36,CirebonText,"Untuk bapak-bapak penjaga keamanan di kala PSHT Vs pendukung sepak bola di Jogja.

Damailah Yogyakarta...",in,0,0,1,2174
https://twitter.com/DosenGarisLucu/status/1665394785547436039,2023-06-04 16:27:13,DosenGarisLucu,Biar ga tambah problematik: LARANG SEMUA AKTIVITAS PSHT DI DIY,in,0,8,14,3338
https://twitter.com/FaziriMuhammad/status/1665394760155119619,2023-06-04 16:27:07,FaziriMuhammad,"Jogja berhenti nyaman? 

#pendekar #psht #jogja #tamsis #tawuran #besoksenin #jungkook #Madrid",in,0,0,15,12940
https://twitter.com/erin_burci6904/status/1665394638176305156,2023-06-04 16:26:37,erin_burci6904,"Alat pembersih layar kaca 
https://shope.ee/5UztEeSKJ2

sooyoung pendekar silat alan umr jogja walker psht bm psim boiyen andara snsd besok senin mark lee yoona indra dorama brajamusti kemenpora gacoan tamsis brajamusti Nasgor jejak si gundul Dewa 19 Nunung",in,0,0,0,2797
https://twitter.com/Jerukni01528287/status/1665394494555197440,2023-06-04 16:26:03,Jerukni01528287,Rombongan PSHT dari luar Yogya disuruh putar balik di batas kota,in,7,6,70,68397
https://twitter.com/erhakeeem/status/1665394328607526912,2023-06-04 16:25:24,erhakeeem,Lha neg psht ngantemi wong neng dalan ngansi ajor njuk dadi masalah opo..,in,0,0,0,633
https://twitter.com/bayunoreee/status/1665394271577407488,2023-06-04 16:25:10,bayunoreee,Iseh medeni Raden Kian Santang  timbang psht ,in,0,0,1,529
https://twitter.com/raysajaa1/status/1665394229009608704,2023-06-04 16:25:00,raysajaa1,"Psht sak retiku wong2an ora arogan mas , tur psht yo ora ngajari ngenengi wong²an ra bersalah. Koyo kang bakso ro juru parkir misale.",in,1,0,5,1367
https://twitter.com/Valdined1/status/1665394215000629253,2023-06-04 16:24:57,Valdined1,"Tonggoku ono PSHT muleh sandalan motore keri tak takoni ra ngaku diselehke ngendi, wkwkwk",in,0,0,4,693
https://twitter.com/devsyaniya/status/1665394212882247682,2023-06-04 16:24:56,devsyaniya,Iya pi kata temenku yg rumahnya di bantul itu tuh balas dendam gegara  ada anggota psht kebacok di Parangtritis,in,1,0,0,552
https://twitter.com/erhakeeem/status/1665394082741645312,2023-06-04 16:24:25,erhakeeem,Moas moas. Kurang pie sakjane. Ra patut psht disebut pendekar.,in,0,0,2,1048
https://twitter.com/YulkhanManying/status/1665393993813721090,2023-06-04 16:24:04,YulkhanManying,Goblok tenan nek iki psht,in,0,0,2,913
https://twitter.com/imandiharjoo/status/1665393782659981317,2023-06-04 16:23:13,imandiharjoo,Wah jebul buntute dowo yo mas. Iki kudune petinggi PSHT di duduke bareng. Ben kabeh do adem. Pokoe mugo2 Mandali kabeh mas. Amiin,in,1,0,0,1270
https://twitter.com/tigakoosong/status/1665393690725031939,2023-06-04 16:22:52,tigakoosong,mau puter balik gabisa. depan mobil. samping & belakang orang2 psht itu,in,0,0,0,647
https://twitter.com/Haqins1/status/1665393644772429824,2023-06-04 16:22:41,Haqins1,Rak heran yen psht. Ket mbien silat yg tak percoyo mun TS. Mergane adem ayem lan silate mlebu neng akal. Nek anu sering ditawari silat tapi gah. Silat silat ngunu kok nganggo tenaga dalam. Berarti kekuatanne palsu ogh...,in,0,0,1,486
https://twitter.com/Agnibrataa/status/1665393617438121984,2023-06-04 16:22:34,Agnibrataa,Pendekar PSHT sek jarene seko Jawa Timuran ki sesok do ra kerjo po yo? Sesok senin lho om.,in,0,0,0,1036
https://twitter.com/5rotii2iikan/status/1665393545170272256,2023-06-04 16:22:17,5rotii2iikan,"Bagi mas2 psht yg mau nglurug jogja,jgn lupa besok senen, wayahe sekolah karo nyambut gawe...mung mudorot buang2 bensin kesel nang ndalan",in,0,0,0,1164
https://twitter.com/Dekersed/status/1665393485984456704,2023-06-04 16:22:03,Dekersed,"mungkin mksdnya BM kumpulnya di kota, jadi mau ga mau PSHT nyamperin kesana. 
krna gaada yg keluar dri siang (BM) makanya PSHT yang nyamperin, jadi seolah menggiring PSHT untuk datang ke kota.

mungkin begitu om #cmiw",in,1,0,2,1715
https://twitter.com/arnoldneverstar/status/1665393231293497344,2023-06-04 16:21:02,arnoldneverstar,"Pelaku tersebut 3 orang udah ditangan polres bantul mas, lalu hari ini mau ngejar apalagi ha?????????? Emang dasarnya pengen rusuh aja udah gk usah dibenarankan, dan ini juga akan jadi kasus baru tentunya buat psht di polisi",in,3,0,4,1268
https://twitter.com/takbisamemiliky/status/1665393200687636483,2023-06-04 16:20:55,takbisamemiliky,Katanya sih ada anggota psht yg negur sekelompok orang yg lagi kumpul nyalain musik gede trs malah dikeroyok alhasil paguyuban psht gak terima dan terjadilan invasi versi lite yg dilakukan kelompok psht,in,1,0,0,512
https://twitter.com/MiracleBut2059/status/1665393080835653634,2023-06-04 16:20:26,MiracleBut2059,"Sikat dot botol baby
https://shope.ee/2ffhra4P7g

sooyoung pendekar silat alan umr jogja walker psht bm psim boiyen andara snsd besok senin mark lee yoona indra dorama brajamusti kemenpora gacoan tamsis brajamusti Nasgor jejak si gundul Dewa 19 Nunung",in,0,0,0,2859
https://twitter.com/CirebonText/status/1665392655453536257,2023-06-04 16:18:45,CirebonText,"Stop tawuran, stop kekerasan. Sudahi PSHT vs Suporter bola di Jogja.

Kami rindu Yogyakarta yang nyaman.",in,1,0,1,2197
https://twitter.com/Merpatislot88/status/1665392639552679943,2023-06-04 16:18:41,Merpatislot88,"YUK DUKUNG JAGOAN MU & SEGERA MAINKAN DI MERPATISLOT88
https://mps88.info
#Jogja #PSHT #Boiyen #Ukraina #AlanWalker #AkuMilikmu #Tamsis #Nunung #FreeSenegal #DeGea #DrRomantic3Ep12 #Game2 #Gundogan #Ferrari #WeStandWithBaekhyun #rtp #Madrid #Yoona #Nasgor #maxwin #juara",in,0,0,0,973
https://twitter.com/lokitdulu92/status/1665392627917934592,2023-06-04 16:18:38,lokitdulu92,BUBARKAN PSHT!,in,0,0,2,558
https://twitter.com/Bobohogue/status/1665392614818889731,2023-06-04 16:18:35,Bobohogue,Iki masalah suporter bola muas. Suporter bar ngantemi wong PSHT sampai ajor. Kronologine ngono mula kejadiane. Seko solo magelang wes do mangkat arah jogja kabare,in,8,0,0,2326
https://twitter.com/bayuangin2005/status/1665392592333463552,2023-06-04 16:18:30,bayuangin2005,Ngene ki nko po yo ganti arep dikerahno PSHT SE INDONESIA???? JNCOK ANCENE,in,0,0,0,1345
https://twitter.com/mangeakdekkk/status/1665392403807719426,2023-06-04 16:17:45,mangeakdekkk,psht p ne kepanjangan seko pekok,in,0,0,1,978
https://twitter.com/dhimxs/status/1665392403807608835,2023-06-04 16:17:45,dhimxs,"psht mu i sepele moass, pendekar ki minimal numpak jaran opo nogo ora malah numpak truk hongib xixixi",in,0,0,2,1350
https://twitter.com/MiracleBut2059/status/1665392311847604224,2023-06-04 16:17:23,MiracleBut2059,"Rak sepatu tingkat zigzag
https://shope.ee/5Uzzu63f5U

sooyoung pendekar silat alan umr jogja walker psht bm psim boiyen andara snsd besok senin mark lee yoona indra dorama brajamusti kemenpora gacoan tamsis brajamusti Nasgor jejak si gundul Dewa 19 Nunung",in,0,1,0,2888
https://twitter.com/eLbaraj_/status/1665392309654155265,2023-06-04 16:17:22,eLbaraj_,"Jogja PSHT layaknya bunga dengan nama yang tak diketahui

 https://youtu.be/WzxtlZb95B4
#jogja #psht",in,0,0,1,2572
https://twitter.com/5rotii2iikan/status/1665392221766705154,2023-06-04 16:17:01,5rotii2iikan,"Sesuk ki senen mas2 psht, wayahe upacara,nyambut gawe..kok le selo men uripmu",in,0,0,5,4973
https://twitter.com/ahmadfawzi651/status/1665392138048159745,2023-06-04 16:16:41,ahmadfawzi651,"Trending : Aku Milikmu Jogja Masih Ada Tawuran PSHT 
Solaria Formula E
*****
Coba cek ini di Tokopedia, deh. Harganya Rp254.000
https://tokopedia.link/uIJoitMpmAb",in,0,0,0,1492
https://twitter.com/ikhslamal/status/1665392069127602176,2023-06-04 16:16:25,ikhslamal,Udah bubarin aja tu yg namanya psht,in,0,0,1,852
https://twitter.com/ahmadfawzi651/status/1665391975917318146,2023-06-04 16:16:03,ahmadfawzi651,"Trending : Aku Milikmu Jogja Masih Ada Tawuran PSHT 
Solaria Formula E
*****
Coba cek ini di Tokopedia, deh. Harganya Rp254.000
https://tokopedia.link/GGGVryJpmAb",in,0,0,0,1428
https://twitter.com/sotokarang/status/1665391952261464065,2023-06-04 16:15:57,sotokarang,"Nasgor kami
Mau?? Silakan mampir
 .
Tamsis tawuran PSHT Brajamusti jogja",in,0,0,0,4877
https://twitter.com/Haqins1/status/1665391869000577029,2023-06-04 16:15:37,Haqins1,Wes biasa mah nek psht. Rak kabeh masalah biso dikelarne mbek rusuh ngunu. Mesakno warga liyane seng rk bersalah melu imbase. Solidaritas yo solidaritas nek meh gelud mbek psim yo ojo ngerusuh kr warga2 liyane.,in,1,0,7,21259
https://twitter.com/babyarmy_n/status/1665391863526989827,2023-06-04 16:15:36,babyarmy_n,Pendopo taman siswa #jogja #psht,in,0,9,64,54534
https://twitter.com/orgasnme/status/1665391815342665732,2023-06-04 16:15:24,orgasnme,psht gasii,in,1,0,0,402
https://twitter.com/syalifah_angel/status/1665391661847924737,2023-06-04 16:14:48,syalifah_angel,"Link skandal rebbeca syakirah hijab abg viral diatas linknya baru
#DODMOM Netflix Spotify Mvs #ANIME PSHT Tawuran Jogja Pendekar Nunung Sosmed",in,0,0,0,2826
https://twitter.com/RantauWarrior13/status/1665391630931615746,2023-06-04 16:14:40,RantauWarrior13,Nek kepancing malah PSHT lawane wong sa alam dunyo mas ,in,2,0,0,1554
https://twitter.com/PanuKolektor/status/1665391607728799744,2023-06-04 16:14:35,PanuKolektor,Mau sore jam 3 ketemu neng lor kalasan do mangkat ngulon. Kemungkinan besar PSHT prambanan klaten.,in,0,0,1,2844
https://twitter.com/MiracleBut2059/status/1665391597205192707,2023-06-04 16:14:32,MiracleBut2059,"Kotak makan 
 : https://shope.ee/9epYrzdLBA

gacoan tamsis brajamusti Nasgor jejak si gundul Dewa 19 Nunung sooyoung pendekar silat alan umr jogja walker psht bm psim boiyen andara snsd besok senin mark lee yoona indra dorama brajamusti kemenpora",in,0,0,0,2648
https://twitter.com/eLbaraj_/status/1665391580725882882,2023-06-04 16:14:28,eLbaraj_,"REAL LIFE! Bocchi The Rock! Jogja PSHT

https://youtu.be/cdJd5aYA1z8
#jogja #psht",in,0,0,0,1505
https://twitter.com/MRivayanto/status/1665391387536424963,2023-06-04 16:13:42,MRivayanto,"pancen PSHT kudu dilawan,nek ora iso gawe rusuh terus koyo neng jawa timur.....",in,0,0,0,435
https://twitter.com/ahmadfazafauzan/status/1665391371547561984,2023-06-04 16:13:39,ahmadfazafauzan,Nek nang grup psht facebook ditulis psim vs psht,in,0,0,0,2567
https://twitter.com/MiracleBut2059/status/1665391305932050432,2023-06-04 16:13:23,MiracleBut2059,"Vacum Makanan
https://shope.ee/7Ul4IoA8WG

gacoan tamsis brajamusti Nasgor jejak si gundul Dewa 19 Nunung sooyoung pendekar silat alan umr jogja walker psht bm psim boiyen andara snsd besok senin mark lee yoona indra dorama brajamusti kemenpora",in,0,1,0,2600
https://twitter.com/aakubiruu/status/1665391258087333889,2023-06-04 16:13:12,aakubiruu,#psht pendekar2mu kuwi diajari adab,in,0,0,0,2190
https://twitter.com/tamagochiCDMA/status/1665391205973397504,2023-06-04 16:12:59,tamagochiCDMA,"Aku kate takon lurr
PSHT iku kepanjangane opo yo.?? 
Sepurane Ket eroh jeneng iku 
Tak pikir malah jenenge Obat loro untu kok. 

#jogja",in,0,0,1,875
https://twitter.com/ryansaefulloh1/status/1665391103619780614,2023-06-04 16:12:35,ryansaefulloh1,"abisin aja udah psht sampe akar akar nya, perguruan ko cuman bikin rusuh sebelum nya di malang blitar pun juga",in,0,0,1,1274
https://twitter.com/idrisxash/status/1665391074934915080,2023-06-04 16:12:28,idrisxash,lagi gayeng ro psht malah njedul kongene :(,in,0,0,1,519
https://twitter.com/inthe_Skyyyyy/status/1665391068416819201,2023-06-04 16:12:26,inthe_Skyyyyy,Salahnya psht di jogja ngapain siih? Ko kudet aku,in,2,0,3,5167
https://twitter.com/Lvfsdy/status/1665391064516112385,2023-06-04 16:12:25,Lvfsdy,"ICJ malah sepi, gak ono postingan tentang tawuran PSHT vs Warga Jogja
Paling update di-grup ""gojek seputar jogja"" bener-bener berasa di-live report ",in,1,0,2,2497
https://twitter.com/VankaKusuma/status/1665391055204933632,2023-06-04 16:12:23,VankaKusuma,Alhamdulillah atlet PSHT ki wes akeh ndulang medali mas,in,1,0,0,530
https://twitter.com/officebois/status/1665391003744739336,2023-06-04 16:12:11,officebois,Abi ge kiyeu2 baheula na ngiringan psht,in,3,0,1,1325
https://twitter.com/DonVampir/status/1665390989106876416,2023-06-04 16:12:07,DonVampir,Kok ora rampung-rampung to le e bentrokan. Seiki PSHT luar Jogja mulai masuk Jogja ,in,0,1,1,1462
https://twitter.com/eLbaraj_/status/1665390873637539842,2023-06-04 16:11:40,eLbaraj_,"Jogja PSHT ''Bertaut''

https://youtu.be/8puXxyjuq6o
#jogja #psht",in,0,0,0,2040
https://twitter.com/rezkyyusuf5/status/1665390848844898306,2023-06-04 16:11:34,rezkyyusuf5,"Jelas2 kaose teratai, Ini dr pihak psht, psht juga ada yg warga jogja, sama2 psht, sama2 warga jogja, jur kepiye jal 

Mending turu ra resiko bos",in,5,0,2,4304
https://twitter.com/Syabrinanita/status/1665390680401641475,2023-06-04 16:10:54,Syabrinanita,"
#DODMOM Netflix Spotify Mvs #ANIME PSHT Tawuran Jogja Pendekar Nunung Sosmed",in,0,1,2,812
https://twitter.com/yprks48/status/1665390359063707648,2023-06-04 16:09:37,yprks48,"Mercon bos, dibiasain jangan komen ngawur kalau ga tau. Itu kendaraan mengangkut warga psht yg diamankan",in,1,0,12,1963
https://twitter.com/sanditatto/status/1665389938999988224,2023-06-04 16:07:57,sanditatto,"mas, niku kronologis e kok tiba2 wonten PSHT niku pripun to mas?",in,3,0,1,9611
https://twitter.com/amiraprshnt/status/1665389877985263618,2023-06-04 16:07:43,amiraprshnt,Psht jare yik jki tekan kampuse adekku sisan iki,in,1,1,0,491
https://twitter.com/Bobohogue/status/1665389692987281409,2023-06-04 16:06:58,Bobohogue,PSHT luar kota wes siap. Bajilak mesake jogja seng ng luar kota,in,2,0,6,6468
https://twitter.com/firmanto04/status/1665389684132904961,2023-06-04 16:06:56,firmanto04,"Aku mumet jane vidio kui, warga jogja atau psht nya?",in,4,0,0,5708
https://twitter.com/HowardClin42038/status/1665389623915282443,2023-06-04 16:06:42,HowardClin42038,"Rak Bumbu Dapur 
https://shope.ee/8UddW6EHR3

gacoan tamsis brajamusti Nasgor jejak si gundul Dewa 19 Nunung sooyoung pendekar silat alan umr jogja walker psht bm psim boiyen andara snsd besok senin mark lee yoona indra dorama brajamusti kemenpora",in,0,0,0,2386
https://twitter.com/Ariya_Shinichi/status/1665389425961082882,2023-06-04 16:05:55,Ariya_Shinichi,infone lurd tawuran PSHT wis rampungan durung? Jalan masih macet kagak?,in,3,1,32,11084
https://twitter.com/OfficialZavior/status/1665389425025593346,2023-06-04 16:05:55,OfficialZavior,Psht,en,0,0,0,353
https://twitter.com/eLbaraj_/status/1665389388854079489,2023-06-04 16:05:46,eLbaraj_,"GIPYAK jogja psht

https://youtu.be/MC4l5tFRmWQ
#jogja #psht",in,0,0,0,2511
https://twitter.com/amisetyandisw/status/1665389370000691200,2023-06-04 16:05:41,amisetyandisw,oknumu bacok anggota psht mas wes ruh urung,in,2,0,0,555
https://twitter.com/dreamoontail/status/1665389333178880000,2023-06-04 16:05:33,dreamoontail,"Psht welll, tiap latihan bareng aiwkowk",in,0,0,1,405
https://twitter.com/ArifMonstro/status/1665389285154095104,2023-06-04 16:05:21,ArifMonstro,"Percoyo mas nek Psht iki akeh, neng yo mbok fokus karo masalah awale ojo kok kabeh2 melu dirugekke, saiki musuhe wes warga Jogja lo",in,1,0,3,1742
https://twitter.com/jisoo_opp/status/1665389263230488576,2023-06-04 16:05:16,jisoo_opp,PSHT banci ndakik ndakik rk ceto,in,0,0,2,899
https://twitter.com/fasayaza59638/status/1665389161791070208,2023-06-04 16:04:52,fasayaza59638,Psht SE Jateng bukan psht Bantul,in,0,0,2,355
https://twitter.com/Jaresayang_/status/1665389090118705153,2023-06-04 16:04:35,Jaresayang_,PSHT luar kota wes siap opo mas? Siap ngantemi wong?,in,0,0,2,556
https://twitter.com/HowardClin42038/status/1665389066941255680,2023-06-04 16:04:29,HowardClin42038,"Totebag muat banyak
https://shope.ee/9p923zuIT7

gacoan tamsis brajamusti Nasgor jejak si gundul Dewa 19 Nunung sooyoung pendekar silat alan umr jogja walker psht bm psim boiyen andara snsd besok senin mark lee yoona indra dorama brajamusti kemenpora",in,0,0,0,2357
https://twitter.com/andigelap_/status/1665389055771652105,2023-06-04 16:04:26,andigelap_,lha nek psht ki karo pemuda pancasila podo ra si?,in,0,0,3,583
https://twitter.com/LeePangestika/status/1665388773541298177,2023-06-04 16:03:19,LeePangestika,"Lah mknya itu mas .. cba denger lgi video ny .. 
Dia bilang PSHT",in,0,0,1,378
https://twitter.com/berpikirdingin/status/1665388743862173698,2023-06-04 16:03:12,berpikirdingin,"Maksudnya pendekar minta oerang sama warga joga itu apa? Arogan banget. Yang mulai duluan itu anggota kalian, yang arogan itu anggota psht. Bilang aja dikawal, malah minta perang. Dipikir mati syahid? Dipikir jihad, pake takbir segala. Kalo goblok ga usah sok ngomong perang.",in,1,0,2,782
https://twitter.com/GodzilaTampan/status/1665388736203603968,2023-06-04 16:03:10,GodzilaTampan,lha jare wong psht ki pendekar...lha kok malah gawa watu n gaman? trus gunane latian ilmu silat n kebal senjata nggo opo? ben nek dientup tawon ora mlentung?,in,0,1,3,1255
https://twitter.com/eLbaraj_/status/1665388669996236804,2023-06-04 16:02:55,eLbaraj_,"Lekas pulih Jogja PSHT

https://youtu.be/uu0w15Q9Am4
#jogja #psht",in,0,0,0,2267
https://twitter.com/MerapiWarga/status/1665388637205438466,2023-06-04 16:02:47,MerapiWarga,"Inilah istimewanya warga Jogja khususnya & warga plus62 pada umumnya

Tetep jualan ditengah geger geden antara warga vs PSHT di area tamsis.

Tetap semangat lur, moga daganganya laris manis tanjung kimpul.",in,166,693,2772,379107
https://twitter.com/LeePangestika/status/1665388567131029505,2023-06-04 16:02:30,LeePangestika,"Hadeh, smpe gw di bilang jempolnya nyocot .. gw jga dengernya PSHT ..
Btw gw cewe, tp pda mangilny mas ..",in,0,0,0,331
https://twitter.com/HowardClin42038/status/1665388553738543105,2023-06-04 16:02:27,HowardClin42038,"Handuk rambut
https://shope.ee/1q6kXfFjij

gacoan tamsis  lewis brajamusti Nasgor jejak si gundul Dewa 19 Nunung sooyoung pendekar silat alan umr jogja walker psht bm psim boiyen andara snsd besok senin mark lee yoona indra dorama brajamusti kemenpora",in,0,0,1,2356
https://twitter.com/santirahayu/status/1665388481445543938,2023-06-04 16:02:10,santirahayu,psht psht.. wes meneng.. turu turu.. ribut ae.. anakku suk ujian ndak ra iso turu.. psht meneng.. ,in,0,0,0,363
https://twitter.com/maharsenal/status/1665388319499231233,2023-06-04 16:01:31,maharsenal,PSHT tu apa kak,in,2,0,0,377
https://twitter.com/Bobohogue/status/1665388282018951168,2023-06-04 16:01:22,Bobohogue,Ati2 nek ngomong. PSHT luar kota wes siap. Mesake wong jogja luar kota. Ojo gawe provokasi. Sangat bahaya,in,2,0,0,1569
https://twitter.com/Bvrnnnn/status/1665388250834300928,2023-06-04 16:01:15,Bvrnnnn,PSHT prestasine opo liane konvoi karo gawe rusuh neng dalan? Neng jatim yo meresahkan,in,23,1,105,55917
https://twitter.com/Tsw_fdl31/status/1665388190809849856,2023-06-04 16:01:00,Tsw_fdl31,"Mas aq karo warga sak temanggung melu prihatin, ora meh melu blok jogja atau blok PSHT, tp negara iki negara sg menjunjung tinggi musyawarah, wes podo-podo gedhe, ojo kisruh maneh mas, dirembug sg apik, dadio organisasi sg apik dan iso dadi ciri khas e Indonesia, salam damai bolo",in,0,0,15,3203
https://twitter.com/Valdined1/status/1665388142088835072,2023-06-04 16:00:49,Valdined1,"1 PSHT vs 5 BM, aku wasit e",in,0,0,1,584
https://twitter.com/CirebonText/status/1665388057753681927,2023-06-04 16:00:29,CirebonText,Banyak yg ngomongin PSHT. Apa itu?,in,1,0,0,925
https://twitter.com/doncarlo9999/status/1665388003144134656,2023-06-04 16:00:16,doncarlo9999,Iki wong jogja jaluk jaminan warga aman mas udu psht ne,in,0,0,3,2514
https://twitter.com/ZavierChri57658/status/1665388001231507456,2023-06-04 16:00:15,ZavierChri57658,"Penghangat air
https://shope.ee/3Ac89PMH03

gacoan tamsis  lewis brajamusti Nasgor jejak si gundul Dewa 19 Nunung sooyoung pendekar silat alan umr jogja walker psht bm psim boiyen andara snsd besok senin mark lee yoona indra dorama brajamusti kemenpora",in,0,0,0,2303
https://twitter.com/999Achlis/status/1665387748771889159,2023-06-04 15:59:15,999Achlis,Semoga PSHT luar kota jogja tidak ter provokasi. Sangat bahaya jika terpancing. Kasihan orang jogja kalo mau ke luat kota,in,5,0,2,8913
https://twitter.com/julianz73/status/1665387747270443008,2023-06-04 15:59:15,julianz73,@PSHT_Indonesia,qam,0,0,0,524
https://twitter.com/nagathara_id/status/1665387673023029253,2023-06-04 15:58:57,nagathara_id,JOGJA RA BUTUH PENDEKAR #jogja #psht #tawuran,in,2,6,52,54750
https://twitter.com/eLbaraj_/status/1665387600566165506,2023-06-04 15:58:40,eLbaraj_,"sekarang apa kabar Jogja psht ?

https://youtu.be/i5COURZiLY0
#jogja #psht",in,0,0,0,2530
https://twitter.com/almunqizah/status/1665387543947345922,2023-06-04 15:58:26,almunqizah,"Sek di aniyaya warga psht yo wong jogjaa, bapak2 lagi golek nafka, malah suporter bola kewer goleh sasaran nganiyaya, saiki digruduk gowo jeneng jogja telek, telek,, atiran nek emang jentel teko ormas mu gowo tersangka nang polres bantul ra malah ngajak rusuh #psht #tamsis #psim",in,93,3,97,93629
https://twitter.com/iBayem/status/1665387470953799680,2023-06-04 15:58:09,iBayem,"yang tadi rame PSHT itu ya, Kang?",in,1,0,0,460
https://twitter.com/MantapAnying/status/1665387466830782465,2023-06-04 15:58:08,MantapAnying,Psht magelang do ora nonton lampion ng budur po ?,tl,0,0,0,2865
https://twitter.com/devsyaniya/status/1665387461332303873,2023-06-04 15:58:06,devsyaniya,"cekcok antara psht sama brajamusti pii, supporter bola",in,1,0,0,492
https://twitter.com/grcalvinnn/status/1665387373121912838,2023-06-04 15:57:45,grcalvinnn,"pie to psht malah gawe gawe ngono kui, iki jogja bossss",in,0,0,0,2587
https://twitter.com/raizqi/status/1665387353857486848,2023-06-04 15:57:41,raizqi,psht ki klub bal2an endi,in,5,0,1,1297
https://twitter.com/alvin_yan/status/1665387262148853763,2023-06-04 15:57:19,alvin_yan,Kui PSHT kirim papua lawan KKB opo yo isih kementus ngono,in,1,0,1,1555
https://twitter.com/WindiClara/status/1665387233573216257,2023-06-04 15:57:12,WindiClara,PSHT SAMPAH MASYARAKAT,in,1,0,0,307
https://twitter.com/ediscoot19/status/1665387180674433025,2023-06-04 15:56:59,ediscoot19,Pateni aee PSHT,in,2,0,3,3965
https://twitter.com/ZavierChri57658/status/1665387166883811328,2023-06-04 15:56:56,ZavierChri57658,"Alat cukur mini
https://shope.ee/6Usa96NCHi 

gacoan tamsis  lewis brajamusti Nasgor jejak si gundul Dewa 19 Nunung sooyoung pendekar silat alan umr jogja walker psht bm psim boiyen andara snsd besok senin mark lee yoona indra dorama brajamusti aku milikmu",in,0,0,0,2558
